Stage,Description,CLI_Impact,Example
1,Promise transformative labor rights (Art. 14bis),0,1949: Ultra-activity clause (Art. 14bis)
2,Fail to implement due to fiscal/economic cost,0,"1991-2025: Informality 35-45%, unfunded mandates"
3,Attempt reform to reduce cost/increase flexibility,0,1991-2025: 23 reform attempts
4,Reform blocked by constitutional lock-in (CSJN),0,"CSJN Vizzoti, Aquino, Pérez doctrines block"
5,Failed reform INCREASES lock-in (precedent),+0.02,Each block creates precedent strengthening lock-in
6,Return to Stage 1 with HIGHER CLI,+cumulative,CLI: 0.45 (1949) → 0.87 (2025)
